{
  "$schema": "https://json-schema.org/draft/2020-12/schema",
  "$id": "https://github.com/ospex-org/ospex-artifacts/schemas/scenario-matrix.schema.json",
  "title": "Ospex Run Scenario Matrix",
  "description": "Per-run scenario matrix for live canary runs. Version 2 is the first schema-backed shape; earlier scenario-matrix.json files predate this schema and are grandfathered. See docs/mm-live-canary-evidence.md.",
  "type": "object",
  "additionalProperties": true,
  "required": ["$schema", "schemaVersion", "artifactId", "generatedAt", "runClass", "scenarios"],
  "properties": {
    "$schema": {
      "type": "string",
      "const": "https://github.com/ospex-org/ospex-artifacts/schemas/scenario-matrix.schema.json"
    },
    "schemaVersion": {
      "type": "integer",
      "minimum": 2
    },
    "artifactId": {
      "type": "string",
      "description": "Must equal the run artifact directory name.",
      "minLength": 1
    },
    "generatedAt": {
      "type": "string",
      "format": "date-time"
    },
    "runClass": {
      "type": "string",
      "description": "Run class this matrix instantiates. A closed registry enforced by the validator; a new run class is added to the registry (and this enum) together with its own pairing and capability rules.",
      "enum": ["mm-live-canary"]
    },
    "scenarios": {
      "type": "array",
      "minItems": 1,
      "items": {
        "type": "object",
        "additionalProperties": true,
        "required": ["id", "scenario", "status", "notes"],
        "properties": {
          "id": {
            "type": "string",
            "description": "Stable kebab-case scenario identifier, unique within the matrix.",
            "pattern": "^[a-z0-9]+(-[a-z0-9]+)*$"
          },
          "scenario": {
            "type": "string",
            "description": "Human-readable scenario label.",
            "minLength": 1
          },
          "status": {
            "type": "string",
            "description": "Scenario-level result. This is local to the scenario row; artifact-level status keeps its own controlled vocabulary.",
            "enum": ["pass", "pass_with_caveats", "fail", "deferred", "not_run", "not_applicable"]
          },
          "evidence": {
            "type": ["string", "null"],
            "description": "Path to the supporting sanitized evidence file, relative to the artifact directory. Null only when status is deferred, not_run, or not_applicable."
          },
          "notes": {
            "type": "string",
            "description": "Factual, test-scoped notes. Team references follow the Team Identity Rule: actual team name plus home/away role.",
            "minLength": 1
          }
        }
      }
    }
  }
}
