{
  "$schema": "https://github.com/ospex-org/ospex-artifacts/schemas/scenario-matrix.schema.json",
  "schemaVersion": 2,
  "artifactId": "2026-07-04-mlb-min-nyy-contest-10-v010-mm146-all-markets-stage1-canary",
  "generatedAt": "2026-07-04T22:19:04Z",
  "runClass": "mm-live-canary",
  "scenarios": [
    {
      "id": "target-preflight",
      "scenario": "Target preflight and allowlist",
      "status": "pass",
      "evidence": "raw/target-preflight.sanitized.json",
      "notes": "Primary MIN away @ NYY home contest 10/specs 18/19/20 passed pre-game status, identity, allowlist, odds, and lead-time gates."
    },
    {
      "id": "repo-runtime-gates",
      "scenario": "Repo/runtime gates",
      "status": "pass",
      "evidence": "raw/release-runtime-matrix.sanitized.json",
      "notes": "SDK/CLI v0.10.0, MM head 6f3ccc1 with PR #146 approval self-heal and PR #145 own-state orphan safety coverage, installed SDK v0.9.0, typecheck/test/build, and ancillary repo heads were verified."
    },
    {
      "id": "wallet-auth-balances",
      "scenario": "Wallet auth, balances, allowances",
      "status": "pass",
      "evidence": "raw/wallet-auth-balance-allowances.sanitized.json",
      "notes": "Expected-address checks passed for ospex-stage-maker-b, ospex-stage-maker-a, and ospex-flow-a; public allowances were bounded."
    },
    {
      "id": "bounded-approvals",
      "scenario": "Bounded approvals / no unlimited approvals",
      "status": "pass",
      "evidence": "raw/bounded-approvals.sanitized.json",
      "notes": "Only bounded USDC approvals were used; live autoApprove used exact mode and raised PositionModule allowance from 0.400000 to 0.600001 USDC."
    },
    {
      "id": "dry-run-quote-loop",
      "scenario": "Dry-run quote loop",
      "status": "pass",
      "evidence": "raw/mm-dryrun-summary.sanitized.json",
      "notes": "Candidates --allowlist-only returned contest 10 moneyline, spread, and total quote_ready; dry run would-submit remained target-scoped."
    },
    {
      "id": "live-commitments-posted",
      "scenario": "Live commitments posted",
      "status": "pass_with_caveats",
      "evidence": "raw/live-public-commitments-posted.sanitized.json",
      "notes": "Tiny live moneyline, spread, and total commitments posted under strict allowlist [10], seedSpeculations=false."
    },
    {
      "id": "live-fill",
      "scenario": "Controlled live fill",
      "status": "pass_with_caveats",
      "evidence": "raw/live-fill.sanitized.json",
      "notes": "Two controlled live fills succeeded: spread commitment 0xd44aa5a2fdba\u2026 and total commitment 0x5cd5eb435cba\u2026 using ospex-flow-a."
    },
    {
      "id": "own-state-sse-canonical-fill",
      "scenario": "Own-state SSE canonical fill source",
      "status": "pass",
      "evidence": "raw/own-state-sse-summary.sanitized.json",
      "notes": "Telemetry captured both fills with source own-state-stream for the filled spread and total commitment hashes."
    },
    {
      "id": "exposure-drain-zero",
      "scenario": "Exposure drained to zero",
      "status": "pass",
      "evidence": "raw/zero-exposure.sanitized.json",
      "notes": "Final public/API/MM visible-open exposure is zero, target active/pending/claimable positions are zero after postgame, and no orphan MM process remained."
    },
    {
      "id": "restart-cold-start-safety",
      "scenario": "Restart/cold-start safety",
      "status": "pass",
      "evidence": "raw/restart-cold-start-probe.sanitized.json",
      "notes": "A scratch-state dry-run/cold-start probe loaded state cleanly, expired copied stale records, and did not create duplicate live exposure."
    },
    {
      "id": "postgame-score",
      "scenario": "Postgame score",
      "status": "pass",
      "evidence": "raw/postgame-lifecycle.sanitized.json",
      "notes": "Official final score MIN 11, NYY 4 was verified and contest 10 scored via R5/CRE."
    },
    {
      "id": "postgame-settle",
      "scenario": "Postgame settle",
      "status": "pass",
      "evidence": "raw/postgame-lifecycle.sanitized.json",
      "notes": "Moneyline speculation 18 settled to away/upper/Minnesota Twins; spread 19 to away/upper/Minnesota Twins +1.5; total 20 to over/upper/over 10."
    },
    {
      "id": "postgame-claim",
      "scenario": "Postgame claim/no-op",
      "status": "pass",
      "evidence": "raw/postgame-lifecycle.sanitized.json",
      "notes": "Winning upper positions for stage-maker-a and stage-maker-b were claimed; losing positions are no-op/not claimable, and final target positions are zero."
    },
    {
      "id": "cost-within-cap",
      "scenario": "Cost within cap",
      "status": "pass",
      "evidence": "raw/tx-receipts.summary.json",
      "notes": "Tiny canary risk plus protocol fees stayed within the requested cap; recorded lifecycle transactions are summarized."
    }
  ]
}
