{
  "$schema": "https://github.com/ospex-org/ospex-artifacts/schemas/scenario-matrix.schema.json",
  "schemaVersion": 2,
  "artifactId": "2026-07-04-mlb-mil-ari-contest-11-v010-mm146-two-game-minislate-canary",
  "generatedAt": "2026-07-05T05:15:00Z",
  "runClass": "mm-live-canary",
  "scenarios": [
    {
      "id": "target-preflight",
      "scenario": "Target preflight and allowlist",
      "status": "pass",
      "evidence": "raw/target-preflight.sanitized.json",
      "notes": "Milwaukee Brewers @ Arizona Diamondbacks contest 11 and specs 21/22/23 passed pre-game status, identity, allowlist, odds, and lead-time gates."
    },
    {
      "id": "repo-runtime-gates",
      "scenario": "Repo/runtime gates",
      "status": "pass",
      "evidence": "raw/release-runtime-matrix.sanitized.json",
      "notes": "SDK/CLI v0.10.0, MM head 6f3ccc1 with PR #146 approval self-heal and own-state safety coverage, installed SDK v0.9.0, typecheck/test/build, and ancillary repo heads were verified."
    },
    {
      "id": "wallet-auth-balances",
      "scenario": "Wallet auth, balances, allowances",
      "status": "pass",
      "evidence": "raw/wallet-auth-balance-allowances.sanitized.json",
      "notes": "Expected-address checks passed for ospex-stage-maker-b, ospex-stage-maker-a, and ospex-flow-a; public balances/allowances were bounded."
    },
    {
      "id": "bounded-approvals",
      "scenario": "Bounded approvals / no unlimited approvals",
      "status": "pass",
      "evidence": "raw/bounded-approvals.sanitized.json",
      "notes": "Only bounded USDC approvals were used; no unlimited approvals were created."
    },
    {
      "id": "dry-run-quote-loop",
      "scenario": "Dry-run quote loop",
      "status": "pass",
      "evidence": "raw/mm-dryrun-summary.sanitized.json",
      "notes": "Candidates --allowlist-only returned six quote-ready rows across contests 11 and 12; dry run stayed target-scoped."
    },
    {
      "id": "live-commitments-posted",
      "scenario": "Live commitments posted",
      "status": "pass_with_caveats",
      "evidence": "raw/live-public-commitments-posted.sanitized.json",
      "notes": "Tiny live moneyline, spread, and total commitments posted under strict allowlist [11,12], including contest 11, seedSpeculations=false."
    },
    {
      "id": "live-fill",
      "scenario": "Controlled live fill",
      "status": "pass_with_caveats",
      "evidence": "raw/live-fill.sanitized.json",
      "notes": "A controlled taker filled the MM spread quote: Milwaukee Brewers -1.5. The final score made Arizona Diamondbacks +1.5 the winning lower side, so this controlled live-fill position lost and the MM maker lower-side position was claimable."
    },
    {
      "id": "own-state-sse-canonical-fill",
      "scenario": "Own-state SSE canonical fill source",
      "status": "pass",
      "evidence": "raw/own-state-sse-summary.sanitized.json",
      "notes": "Telemetry captured the controlled fills with source own-state-stream and no unknown-own-fill/divergence safety event."
    },
    {
      "id": "exposure-drain-zero",
      "scenario": "Exposure drained to zero",
      "status": "pass",
      "evidence": "raw/zero-exposure.sanitized.json",
      "notes": "Final public/API/MM visible-open exposure is zero, target active/pending/claimable positions are zero after postgame, and no orphan MM process remained."
    },
    {
      "id": "restart-cold-start-safety",
      "scenario": "Restart/cold-start safety",
      "status": "pass",
      "evidence": "raw/restart-cold-start-probe.sanitized.json",
      "notes": "A scratch-state dry-run/cold-start probe loaded state cleanly, expired copied stale records, and did not create duplicate live exposure."
    },
    {
      "id": "postgame-score",
      "scenario": "Postgame score",
      "status": "pass_with_caveats",
      "evidence": "raw/postgame-lifecycle.sanitized.json",
      "notes": "Official final score Milwaukee Brewers 3, Arizona Diamondbacks 4 was verified and contest 11 scored via R5/CRE. Operator watchdog caveat documented separately."
    },
    {
      "id": "postgame-settle",
      "scenario": "Postgame settle",
      "status": "pass",
      "evidence": "raw/postgame-lifecycle.sanitized.json",
      "notes": "Moneyline, spread, and total speculations for contest 11 settled to the expected lower winning sides where applicable."
    },
    {
      "id": "postgame-claim",
      "scenario": "Postgame claim/no-op",
      "status": "pass",
      "evidence": "raw/postgame-lifecycle.sanitized.json",
      "notes": "Winning controlled positions were claimed, losing positions were no-op/not claimable, and final target positions are zero. One immediate post-claim read lagged; the next verification read was zero."
    },
    {
      "id": "cost-within-cap",
      "scenario": "Cost within cap",
      "status": "pass",
      "evidence": "raw/tx-receipts.summary.json",
      "notes": "Tiny canary risk plus protocol fees stayed within the approved $10 hard cap; recorded lifecycle transactions are summarized."
    }
  ]
}
